{
  "schema_version": "1",
  "recording_id": "0190a8b0-7000-7a00-8000-000000000402",
  "run_id": "0190a8b0-7000-7a00-8000-00000000000a",
  "project_id": "0190a8b0-7000-7a00-8000-000000000100",
  "created_at": "2026-01-02T09:00:00.000Z",
  "capture_completeness": "sealed_incomplete",
  "execution_outcome": "succeeded",
  "adapter": "google-adk",
  "adapter_version": "1.2.4",
  "event_count": 55,
  "stream_count": 3,
  "artifact_count": 0,
  "payload_sha256": "fcde2b2edba56bf408601fb721fe9b5c338d10ee429ea04fae5511b68fbf8fb9",
  "artifact_manifest": [],
  "capture_gaps": [
    {
      "schema_version": "1",
      "gap_id": "0190a8b0-7000-7a00-8000-000000000301",
      "run_id": "0190a8b0-7000-7a00-8000-00000000000a",
      "stream_id": "0190a8b0-7000-7a00-8000-000000000002",
      "after_sequence": 50,
      "expected_count": 1,
      "reason": "timeout",
      "detected_at": "2026-01-02T09:00:00.000Z",
      "detected_by": "server"
    }
  ],
  "source": {
    "kind": "reexecution",
    "reexecution": {
      "reexecution_id": "0190a8b0-7000-7a00-8000-000000000500",
      "recording_id": "0190a8b0-7000-7a00-8000-000000000401",
      "agent_version_id": "0190a8b0-7000-7a00-8000-000000000600",
      "image_digest": "sha256:aaaaaaaaaaaaaaaaaaaaaaaaaaaaaaaaaaaaaaaaaaaaaaaaaaaaaaaaaaaaaaaa",
      "adapter": "google-adk",
      "adapter_version": "1.2.4",
      "model_mode": "recorded",
      "fixture_policy": "strict",
      "initial_state": { "cart": [] },
      "seed": 42,
      "fault_plan": {
        "fault_plan_version": "1",
        "faults": [
          {
            "fault_id": "fault-1",
            "fault_type": "tool.timeout",
            "target_invocation_path": "/agent/inventory/tool/0",
            "parameters": { "delay_ms": 5000 },
            "applied": true
          }
        ]
      },
      "budgets": {
        "max_wall_time_seconds": 120,
        "max_model_calls": 20,
        "max_tool_calls": 100,
        "max_input_tokens": 20000,
        "max_output_tokens": 10000,
        "max_estimated_model_spend_usd": 1.0
      }
    }
  }
}
